{
  "$schema": "Rhodium.ExternalParityManifestSpec.schema.json",
  "ReportVersion": 1,
  "Passed": true,
  "Provider": "ExampleBroker",
  "DatasetId": "example-broker-parity-export-2026-05",
  "GitCommit": "",
  "AcceptedLimitations": [],
  "UnsupportedFeatures": [],
  "Mismatches": [],
  "Fixtures": [
    {
      "Name": "Trading calendar parity",
      "FixtureKind": "TradingCalendar",
      "Provider": "ExampleBroker",
      "DatasetId": "example-broker-calendar-2026-05",
      "ExpectedResultSource": "Broker trading calendar export",
      "CoveredDateRange": "2026-05-01/2026-05-23",
      "InstrumentSet": "SPY,AAPL",
      "AccountType": "Margin",
      "Passed": true,
      "InputArtifactPath": "inputs/trading-calendar-provider.json",
      "OutputArtifactPath": "outputs/trading-calendar-rhodium.json",
      "ComparisonReportPath": "reports/trading-calendar-comparison.json"
    },
    {
      "Name": "Account statement parity",
      "FixtureKind": "AccountStatement",
      "Provider": "ExampleBroker",
      "DatasetId": "example-broker-cash-statement-2026-05",
      "ExpectedResultSource": "Broker account statement export",
      "CoveredDateRange": "2026-05-01/2026-05-23",
      "InstrumentSet": "SPY,AAPL",
      "AccountType": "Margin",
      "Passed": true,
      "InputArtifactPath": "inputs/account-statement-provider.json",
      "OutputArtifactPath": "outputs/account-statement-rhodium.json",
      "ComparisonReportPath": "reports/account-statement-comparison.json"
    },
    {
      "Name": "Margin liquidation financing parity",
      "FixtureKind": "MarginLiquidationFinancing",
      "Provider": "ExampleBroker",
      "DatasetId": "example-broker-margin-financing-2026-05",
      "ExpectedResultSource": "Broker margin, liquidation, and financing statement export",
      "CoveredDateRange": "2026-05-01/2026-05-23",
      "InstrumentSet": "SPY,AAPL",
      "AccountType": "Margin",
      "Passed": true,
      "InputArtifactPath": "inputs/margin-liquidation-financing-provider.json",
      "OutputArtifactPath": "outputs/margin-liquidation-financing-rhodium.json",
      "ComparisonReportPath": "reports/margin-liquidation-financing-comparison.json"
    },
    {
      "Name": "Market replay execution parity",
      "FixtureKind": "MarketReplayExecution",
      "Provider": "ExampleVenue",
      "DatasetId": "example-venue-book-replay-2026-05",
      "ExpectedResultSource": "Venue replay with book, quote, trade, and execution events",
      "CoveredDateRange": "2026-05-01/2026-05-23",
      "InstrumentSet": "SPY,AAPL",
      "AccountType": "Margin",
      "Passed": true,
      "InputArtifactPath": "inputs/market-replay-execution-provider.json",
      "OutputArtifactPath": "outputs/market-replay-execution-rhodium.json",
      "ComparisonReportPath": "reports/market-replay-execution-comparison.json"
    },
    {
      "Name": "Venue order policy parity",
      "FixtureKind": "VenueOrderPolicy",
      "Provider": "ExampleVenue",
      "DatasetId": "example-venue-order-policy-2026-05",
      "ExpectedResultSource": "Venue policy feed with supported order types, constraints, and rejections",
      "CoveredDateRange": "2026-05-01/2026-05-23",
      "InstrumentSet": "SPY,AAPL",
      "AccountType": "Margin",
      "Passed": true,
      "InputArtifactPath": "inputs/venue-order-policy-provider.json",
      "OutputArtifactPath": "outputs/venue-order-policy-rhodium.json",
      "ComparisonReportPath": "reports/venue-order-policy-comparison.json"
    },
    {
      "Name": "Cross venue routing parity",
      "FixtureKind": "CrossVenueRouting",
      "Provider": "ExampleBroker",
      "DatasetId": "example-broker-routing-2026-05",
      "ExpectedResultSource": "Broker routing decision export",
      "CoveredDateRange": "2026-05-01/2026-05-23",
      "InstrumentSet": "SPY,AAPL",
      "AccountType": "Margin",
      "Passed": true,
      "InputArtifactPath": "inputs/cross-venue-routing-provider.json",
      "OutputArtifactPath": "outputs/cross-venue-routing-rhodium.json",
      "ComparisonReportPath": "reports/cross-venue-routing-comparison.json"
    }
  ]
}
